{
 "schema_version": "0.2",
 "source_sha256": "27a1b969cb2cb99d296ac562cac134ec63d52e4f0c75cf9d6bad7c696bc66fe3",
 "status": "partial",
 "decisions": {
  "p195-table-001": {
   "status": "approved",
   "canonical_table_number": "16-6"
  },
  "p196-table-001": {
   "status": "approved",
   "canonical_table_number": "16-7"
  },
  "p271-table-003": {
   "status": "approved",
   "canonical_table_number": "22-1"
  },
  "p298-table-001": {
   "status": "approved",
   "canonical_table_number": "24-1"
  },
  "p298-table-002": {
   "status": "approved",
   "canonical_table_number": "24-2"
  },
  "p75-table-005": {
   "status": "approved",
   "canonical_table_number": "9-5"
  }
 }
}
