{
 "schema_version": "0.2",
 "source_sha256": "b4ade26ba00e0f03ea8c13d89badf5491bcdebbfa10957c4839ecc60f34b3cad",
 "status": "partial",
 "decisions": {
  "p235-table-004": {
   "status": "approved",
   "canonical_table_number": "21-5"
  },
  "p236-table-002": {
   "status": "approved",
   "note": "prose reference to Table 21-5 misdetected as a caption"
  },
  "p237-table-002": {
   "status": "approved",
   "canonical_table_number": "21-6"
  },
  "p237-table-003": {
   "status": "approved",
   "note": "prose note referencing Table 21-6 misdetected as a caption"
  },
  "p43-table-001": {
   "status": "approved",
   "canonical_table_number": "7-1"
  }
 }
}
