{
 "schema_version": "0.2",
 "source_sha256": "5430356218fca280023429a2516c3ac4aa200477a7fedd7d21af2f3562d70e7b",
 "status": "partial",
 "decisions": {
  "p16-table-001": {
   "status": "approved",
   "canonical_table_number": "4-4",
   "note": "the en edition's SysTick counter value table carries no caption"
  },
  "p16-table-002": {
   "status": "approved",
   "canonical_table_number": "4-6",
   "note": "the en edition's SysTick compare value table carries no caption"
  },
  "p27-table-004": {
   "status": "approved",
   "canonical_table_number": "7-11",
   "note": "printed as 7-14"
  }
 }
}
