{
 "schema_version": "0.2",
 "source_sha256": "9c096cbc423ef4b6910a536e6b8c06df3cc541876b129bcc0f3485478613fce6",
 "status": "partial",
 "decisions": {
  "p32-table-001": {
   "status": "approved",
   "canonical_table_number": "2-3"
  },
  "p33-table-001": {
   "status": "approved",
   "note": "repeated caption on the continuation page of Table 2-3"
  }
 }
}
