{
 "schema_version": "0.2",
 "source_sha256": "b5d41c433237eda42111ef2d7bcbfccaa2ed5e22221d52edbff2b38fbe89d03e",
 "status": "partial",
 "decisions": {
  "p312-table-001": {
   "status": "approved",
   "canonical_table_number": "22-1",
   "note": "printed as 22-2"
  },
  "p326-table-001": {
   "status": "approved",
   "canonical_table_number": "22-2"
  },
  "p97-table-004": {
   "status": "approved",
   "canonical_table_number": "10-10"
  }
 }
}
