{
 "schema_version": "0.2",
 "source_sha256": "d961d2291a5d9079a8c391e89e5f9807d0c0fc22f66595c417acfd4ecebdbc44",
 "status": "partial",
 "decisions": {
  "p364-table-001": {
   "status": "approved",
   "canonical_table_number": "21-4"
  },
  "p252-table-003": {
   "status": "approved",
   "canonical_table_number": "15-2",
   "note": "the en edition prints no caption line for this table; a prose reference precedes it"
  },
  "p478-table-003": {
   "status": "approved",
   "canonical_table_number": "26-26",
   "note": "the en edition prints no caption line for this table; a prose reference precedes it"
  }
 }
}
