{
  "schema_version": "0.2",
  "source_sha256": "4eab3aaefc47a73c33c98ef5b9d7c5f775105352e57886524933206dc15eafd2",
  "status": "partial",
  "decisions": {
    "p137-table-003": {
      "status": "approved",
      "canonical_table_number": "9-35"
    },
    "p142-table-006": {
      "status": "approved",
      "canonical_table_number": "9-36"
    },
    "p174-table-014": {
      "status": "approved",
      "canonical_table_number": "11-5"
    },
    "p175-table-002": {
      "status": "approved",
      "canonical_table_number": "11-6"
    },
    "p230-table-002": {
      "status": "approved",
      "canonical_table_number": "15-2"
    },
    "p345-table-005": {
      "status": "approved",
      "canonical_table_number": "22-2"
    },
    "p355-table-001": {
      "status": "approved",
      "canonical_table_number": "22-3"
    },
    "p356-table-002": {
      "status": "approved",
      "canonical_table_number": "22-4"
    },
    "p358-table-001": {
      "status": "approved",
      "canonical_table_number": "22-5"
    },
    "p358-table-004": {
      "status": "approved",
      "canonical_table_number": "22-6"
    },
    "p469-table-004": {
      "status": "approved",
      "canonical_table_number": "27-12"
    },
    "p470-table-002": {
      "status": "approved",
      "canonical_table_number": "27-13"
    },
    "p470-table-003": {
      "status": "approved",
      "canonical_table_number": "27-14"
    },
    "p543-table-002": {
      "status": "approved",
      "canonical_table_number": "31-7"
    },
    "p545-table-001": {
      "status": "approved",
      "canonical_table_number": "31-8"
    },
    "p545-table-002": {
      "status": "approved",
      "canonical_table_number": "31-9",
      "note": "the en edition's source-MAC acceptance table carries no caption"
    },
    "p546-table-001": {
      "status": "approved",
      "canonical_table_number": "31-10",
      "note": "the en edition's remote wake-up frame filter table carries no caption"
    },
    "p550-table-006": {
      "status": "approved",
      "canonical_table_number": "31-11"
    },
    "p550-table-007": {
      "status": "approved",
      "canonical_table_number": "31-12"
    },
    "p551-table-002": {
      "status": "approved",
      "canonical_table_number": "31-13"
    },
    "p553-table-002": {
      "status": "approved",
      "canonical_table_number": "31-14"
    },
    "p553-table-005": {
      "status": "approved",
      "canonical_table_number": "31-15"
    },
    "p553-table-008": {
      "status": "approved",
      "canonical_table_number": "31-16"
    },
    "p554-table-002": {
      "status": "approved",
      "canonical_table_number": "31-17"
    },
    "p554-table-003": {
      "status": "approved",
      "canonical_table_number": "31-18"
    },
    "p554-table-004": {
      "status": "approved",
      "canonical_table_number": "31-19"
    },
    "p556-table-002": {
      "status": "approved",
      "canonical_table_number": "31-20"
    },
    "p556-table-003": {
      "status": "approved",
      "canonical_table_number": "31-21"
    },
    "p557-table-003": {
      "status": "approved",
      "canonical_table_number": "31-22"
    },
    "p557-table-006": {
      "status": "approved",
      "canonical_table_number": "31-23"
    },
    "p561-table-001": {
      "status": "approved",
      "canonical_table_number": "31-24"
    },
    "p644-table-001": {
      "status": "approved",
      "canonical_table_number": "35-4"
    },
    "p667-table-002": {
      "status": "approved",
      "canonical_table_number": "36-7"
    },
    "p828-table-001": {
      "status": "approved",
      "canonical_table_number": "43-9",
      "note": "printed as 38-1"
    }
  }
}
