{
  "schema_version": "0.2",
  "source_sha256": "0b85347d150077b46ac5da940c96323f4aea6805b44b7bc385373090c8741e21",
  "status": "partial",
  "decisions": {
    "p105-table-003": {
      "status": "approved",
      "canonical_table_number": "10-10",
      "note": "v1.2 prints Table 10-10, the number the zh edition already used; v1.1 printed 10-23"
    },
    "p110-table-004": {
      "status": "approved",
      "canonical_table_number": "10-11",
      "note": "v1.2 prints Table 10-11, matching the zh edition; v1.1 printed 10-24"
    },
    "p146-table-002": {
      "status": "approved",
      "canonical_table_number": "12-18",
      "note": "the zh edition lacks this table"
    },
    "p210-table-003": {
      "status": "approved",
      "canonical_table_number": "14-2",
      "note": "the en edition prints no caption line for this table; a prose reference precedes it"
    },
    "p360-table-001": {
      "status": "approved",
      "canonical_table_number": "23-4",
      "note": "v1.2 prints Table 23-4; v1.1 printed 23-5"
    }
  }
}
