{
 "schema_version": "0.2",
 "source_sha256": "2952c163dbff06256dda9b811b48d3c530a9b7c1cc35dcb5b309ecf8e9469043",
 "status": "partial",
 "decisions": {
  "p48-table-002": {
   "status": "approved",
   "canonical_table_number": "3-9-2"
  },
  "p48-table-003": {
   "status": "approved",
   "canonical_table_number": "3-9-3",
   "note": "printed as 3-9-2"
  }
 }
}
