{
 "schema_version": "0.2",
 "source_sha256": "072365c32f93a5540b4e05bd86e85bbc16513a19fcbfd3ad58e8532788121917",
 "status": "partial",
 "decisions": {
  "p161-table-003": {
   "status": "approved",
   "canonical_table_number": "9-35"
  },
  "p167-table-002": {
   "status": "approved",
   "canonical_table_number": "9-36"
  },
  "p205-table-001": {
   "status": "approved",
   "canonical_table_number": "11-5"
  },
  "p205-table-002": {
   "status": "approved",
   "canonical_table_number": "11-6",
   "note": "caption printed as 11-5/ADC1; the table lists R32_ADC2_* registers"
  },
  "p392-table-001": {
   "status": "approved",
   "note": "en-only I3C CCC table; the zh edition does not caption it; the printed 22-x number collides with the later FIFO/error/register series"
  },
  "p393-table-001": {
   "status": "approved",
   "note": "en-only I3C CCC table; the zh edition does not caption it; the printed 22-x number collides with the later FIFO/error/register series"
  },
  "p394-table-001": {
   "status": "approved",
   "note": "en-only I3C CCC table; the zh edition does not caption it; the printed 22-x number collides with the later FIFO/error/register series"
  },
  "p396-table-001": {
   "status": "approved",
   "note": "en-only I3C CCC table; the zh edition does not caption it; the printed 22-x number collides with the later FIFO/error/register series"
  },
  "p397-table-001": {
   "status": "approved",
   "note": "en-only I3C CCC table; the zh edition does not caption it; the printed 22-x number collides with the later FIFO/error/register series"
  },
  "p398-table-001": {
   "status": "approved",
   "note": "en-only I3C CCC table; the zh edition does not caption it; the printed 22-x number collides with the later FIFO/error/register series"
  },
  "p398-table-006": {
   "status": "approved",
   "note": "en-only I3C CCC table; the zh edition does not caption it; the printed 22-x number collides with the later FIFO/error/register series"
  },
  "p405-table-006": {
   "status": "approved",
   "canonical_table_number": "22-2",
   "note": "the printed number collides with the en-only I3C CCC series"
  },
  "p417-table-001": {
   "status": "approved",
   "canonical_table_number": "22-3"
  },
  "p419-table-002": {
   "status": "approved",
   "canonical_table_number": "22-4"
  },
  "p421-table-001": {
   "status": "approved",
   "canonical_table_number": "22-5"
  },
  "p422-table-002": {
   "status": "approved",
   "canonical_table_number": "22-6"
  },
  "p551-table-002": {
   "status": "approved",
   "canonical_table_number": "27-12"
  },
  "p551-table-003": {
   "status": "approved",
   "canonical_table_number": "27-13"
  },
  "p552-table-002": {
   "status": "approved",
   "canonical_table_number": "27-14"
  },
  "p638-table-002": {
   "status": "approved",
   "canonical_table_number": "31-7",
   "note": "printed as 31-5"
  },
  "p641-table-002": {
   "status": "approved",
   "canonical_table_number": "31-8",
   "note": "printed as 31-7"
  },
  "p647-table-006": {
   "status": "approved",
   "canonical_table_number": "31-11",
   "note": "printed as 31-9"
  },
  "p647-table-007": {
   "status": "approved",
   "canonical_table_number": "31-12",
   "note": "printed as 31-10"
  },
  "p648-table-002": {
   "status": "approved",
   "canonical_table_number": "31-13",
   "note": "printed as 31-11"
  },
  "p651-table-002": {
   "status": "approved",
   "canonical_table_number": "31-14",
   "note": "printed as 27-12"
  },
  "p651-table-005": {
   "status": "approved",
   "canonical_table_number": "31-15",
   "note": "printed as 27-13"
  },
  "p652-table-002": {
   "status": "approved",
   "canonical_table_number": "31-16",
   "note": "printed as 27-14"
  },
  "p652-table-005": {
   "status": "approved",
   "canonical_table_number": "31-17",
   "note": "printed as 31-15"
  },
  "p652-table-006": {
   "status": "approved",
   "canonical_table_number": "31-18",
   "note": "printed as 31-16"
  },
  "p653-table-002": {
   "status": "approved",
   "canonical_table_number": "31-19",
   "note": "printed as 31-17"
  },
  "p655-table-002": {
   "status": "approved",
   "canonical_table_number": "31-20",
   "note": "printed as 31-18"
  },
  "p656-table-001": {
   "status": "approved",
   "canonical_table_number": "31-21",
   "note": "printed as 31-19"
  },
  "p656-table-004": {
   "status": "approved",
   "canonical_table_number": "31-22",
   "note": "printed as 31-20"
  },
  "p656-table-007": {
   "status": "approved",
   "canonical_table_number": "31-23",
   "note": "printed as 31-21"
  },
  "p660-table-001": {
   "status": "approved",
   "canonical_table_number": "31-24",
   "note": "printed as 31-22"
  },
  "p759-table-001": {
   "status": "approved",
   "canonical_table_number": "35-4"
  },
  "p787-table-002": {
   "status": "approved",
   "canonical_table_number": "36-7",
   "note": "printed as 35-4"
  },
  "p973-table-001": {
   "status": "approved",
   "canonical_table_number": "43-9"
  },
  "p272-table-003": {
   "status": "approved",
   "canonical_table_number": "15-2",
   "note": "the en edition prints no caption line for this table; a prose reference precedes it"
  }
 }
}
