{
 "schema_version": "0.2",
 "source_sha256": "c7e301eac4790ca1ba112f946bf057139ec7f36be28e142cafc1c286bcc9daa4",
 "status": "partial",
 "decisions": {
  "p163-table-004": {
   "status": "approved",
   "canonical_table_number": "14-4"
  },
  "p164-table-002": {
   "status": "approved",
   "canonical_table_number": "14-5"
  }
 }
}
