{
 "schema_version": "0.2",
 "source_sha256": "7da287f39a8e68944d5d29ebab1f044d3e66552576acdcee1abb493f5a1b9142",
 "status": "partial",
 "decisions": {
  "p281-table-003": {
   "status": "approved",
   "canonical_table_number": "21-5"
  },
  "p282-table-002": {
   "status": "approved",
   "note": "prose reference to Table 21-6 misdetected as a caption"
  },
  "p283-table-002": {
   "status": "approved",
   "canonical_table_number": "21-6"
  },
  "p284-table-002": {
   "status": "approved",
   "note": "prose reference to Table 21-6 misdetected as a caption"
  },
  "p52-table-001": {
   "status": "approved",
   "canonical_table_number": "7-1",
   "note": "printed as 7-8"
  }
 }
}
