{
 "schema_version": "0.2",
 "source_sha256": "b543a875a199a67091193afc16e0f7c4ec365df3b8d35bf93b4cc6546e362591",
 "status": "partial",
 "decisions": {
  "p28-table-002": {
   "status": "approved",
   "canonical_table_number": "7-11",
   "note": "the en edition's progbuf register table carries no caption"
  },
  "p32-table-003": {
   "status": "approved",
   "canonical_table_number": "8-7",
   "note": "the en edition's ISA extension details table carries no caption"
  }
 }
}
