{
 "schema_version": "0.2",
 "source_sha256": "5719208b1846c735434e9e630a9c43068b38898f9bf6432556255187f3a213d4",
 "status": "partial",
 "decisions": {
  "p16-table-002": {
   "status": "approved",
   "canonical_table_number": "2-2"
  },
  "p19-table-001": {
   "status": "approved",
   "canonical_table_number": "2-3",
   "note": "printed as 2-2"
  }
 }
}
