{
 "schema_version": "0.2",
 "source_sha256": "51d2a9f352d2275e52443df131061ec550d674b965722a948f1e6e3393ae93e1",
 "status": "partial",
 "decisions": {
  "p14-table-003": {
   "status": "approved",
   "canonical_table_number": "2-2"
  },
  "p17-table-001": {
   "status": "approved",
   "canonical_table_number": "2-3"
  }
 }
}
