{
 "schema_version": "0.2",
 "source_sha256": "e225c19209016e79be3015156362695d322ee796256999b952ba2c2c2dffa7f5",
 "status": "partial",
 "decisions": {
  "p34-table-003": {
   "status": "approved",
   "canonical_table_number": "3-9-2"
  },
  "p34-table-004": {
   "status": "approved",
   "canonical_table_number": "3-9-3"
  }
 }
}
