{
 "schema_version": "0.2",
 "source_sha256": "7ee87a9b127bf6e95d8b037cade194cdfe28968041b21875e555239506734ecc",
 "status": "partial",
 "decisions": {
  "p26-table-001": {
   "status": "approved",
   "canonical_table_number": "2-2",
   "note": "the en edition lacks the CH32M103G8R6-specific pin note table"
  },
  "p27-table-001": {
   "status": "approved",
   "canonical_table_number": "2-3"
  }
 }
}
