{
 "schema_version": "0.2",
 "source_sha256": "109a7bb0ab9a0b7029f82f05bbf8ba212f879b32a20b00a0c3e1a8f5948629ae",
 "status": "partial",
 "decisions": {
  "p59-table-005": {
   "status": "approved",
   "canonical_table_number": "6-17",
   "note": "printed as 7-17"
  },
  "p66-table-001": {
   "status": "approved",
   "canonical_table_number": "7-2",
   "note": "the en edition lacks the DMA channel mapping table"
  },
  "p67-table-001": {
   "status": "approved",
   "canonical_table_number": "7-3"
  }
 }
}
