{
 "schema_version": "0.2",
 "source_sha256": "c5dc49eb6a0086857bc120cf4c1646fa8530006fe5a21e7bbb632a075daf036a",
 "status": "partial",
 "decisions": {
  "p175-table-002": {
   "status": "approved",
   "canonical_table_number": "14-4"
  },
  "p175-table-003": {
   "status": "approved",
   "canonical_table_number": "14-5",
   "note": "printed as 14-4"
  }
 }
}
