{
 "schema_version": "0.2",
 "source_sha256": "3143314893b1ecc3b04f3c5714c0ee4b7a249c29446c37fb58f9e388e1cce347",
 "status": "partial",
 "decisions": {
  "p66-table-002": {
   "status": "approved",
   "canonical_table_number": "6-17"
  },
  "p75-table-002": {
   "status": "approved",
   "canonical_table_number": "7-3",
   "note": "printed as 7-2; the en edition lacks the DMA channel mapping table"
  }
 }
}
